,movie_name,id,short_comment,score,comment_time,votes,Fake,Marker1,Marker2,Marker3,Marker4,Marker5
204,一点就到家,Morning,懂得包装的电影，插入了视效和音乐让电影支离破碎的剧情变得里琅满目，剧本中其实暗含不错的因素，人物身上的情感线和事业线的结合，对于成功的认识，还有谭卓那一番谈分工的大的主题背景，但最后的收尾实在是太功亏一篑，无论在人物和主题思考都讲得一般。刘昊然的台词有点差，尹昉不少戏都演得像晓明，彭昱畅虽然有塑造痕迹，但他还是最好的。个人还有觉得纳闷的是，这类题材导演都喜欢把家乡的视角放到这么小的村子，其实夹杂中间的四线甚至三线城镇很少被表现，他们的人文不会像村子（祭神和集市）含量这么高了，论发达也还在中下游，那这样的家乡主题该如何表现呢，所以我觉得可能共鸣还得要从这里面去找，不是地域，是由地域塑造的你。,3,2020-10-07 21:45:46,12,0,0,0,0,0,0
205,一点就到家,乔峰,我就想知道郭杰瑞在云南搞的咖啡豆怎么样了！,3,2020-11-12 16:35:55,6,1,1,1,1,1,1
206,一点就到家,居无间,剧本是弱项，但导演对影像的把控和三位演员的表演太加分了，给当下的国产电影增添了难得的元气。所谓“秀兵”，就是“秀才遇见兵”吧。签合同之后，剧作在“容易的事情和正确的事情”之间选择了前者。秀才（现代、咖啡）对兵（传统、普洱）的改革远远没到位。刘昊然“黑化”后又回去，这一笔，即顺从主流的妥协。就像那咖啡，非要加个前缀。,3,2020-11-14 17:41:29,5,0,0,0,0,0,0
207,一点就到家,突然粉碎,国庆档的一缕清风，散装青春合伙人，喜剧桥段很无厘头，创业故事略显夸张仓促，土味造型把三个弟弟的颜值带走了，失败的只是事，不是人，看完你会记住这句话，以及真的很想喝普洱咖啡（片名真的不是对家起的吗？一点不抓人一点没帮助,3,2020-09-28 22:18:31,56,0,0,0,0,0,0
208,一点就到家,翻滚吧！蛋堡,能把浮夸喜剧做到可爱已经不容易，但遗憾的是电影的气质一直在廉价成功学鸡汤和日系脱力喜剧间摇摆，没能花时间好好打磨。尤其到三人吵架高潮戏开始是什么灾难剪辑，完全放弃起承转合进入2倍速播放了，白白可惜了forever young。,3,2020-10-15 10:22:19,6,0,0,0,0,0,0
209,一点就到家,,主题蹭了扶贫，但本质上是成功学。,3,2020-10-02 18:15:42,31,0,0,0,0,0,0
210,一点就到家,喵老师2333,命题作文拍成这样挺可爱的。只是群演们实在演的太好了，三个主演反而游离于电影之外。彭昱畅尹昉两个本地人显得像个异乡人，模仿得了口音模仿不了魂。刘昊然向阳花体质也不像一个从风口跌落无数次的投机者，更像是唐探的一次下乡扶贫。不是三人演的不好，而是在真正的本地人衬托下脱节了。,3,2020-09-29 01:21:48,42,0,0,0,0,1,0
211,一点就到家,metaphor17,有能力的导演随便拍拍就比那些个人强。,3,2020-10-01 15:47:04,41,0,0,0,0,0,0
212,一点就到家,Singin'in rain,轻喜剧，还可以的主旋律故事，节奏比较快，有陈可辛的味道，还顺带致敬了中国合伙人，甚至还有哈利波特lol 由于叙事基调在这里，肯定没法拍成合伙人那样展现创业之艰的作品，导致本片的鸡汤味浓了点（虽然开头看似反鸡汤），创业成功太简单了点。,3,2020-11-13 11:37:09,1,0,0,0,0,0,0
213,一点就到家,鬼腳七,这怕不是改的某个小品剧本，不过心意倒是好的,3,2020-11-11 23:13:22,3,0,0,0,0,0,0
214,一点就到家,what'swilliam,3星半。国庆档观感最轻松节奏最轻快的电影。1.本片最大亮点就是把一个非常土的创业主题拍得年轻时尚又俏皮。2.每一首原声和配乐都好听，有一种莫名的朝气和热带气息。3.创业之外还带了点父子羁绊的主题，比例拿捏尚可。4.剧情还是太顺理成章了，创业中遇到的挫折基本都充当了“工具人”角色，并不算现实，说好听点是乐观，说难听点是浮在半空。5.“所有的出发都是为了回家”。,3,2020-10-04 16:46:07,12,0,0,0,0,0,0
215,一点就到家,杜叶,整一部下沉讨巧版《中国合伙人》，看是能看，尬的也不少。好玩的是，主题刚好切了隔壁同档期的“我和我的家乡”。相较之下《喜欢你》更顺畅，许宏宇这种“不切实际流”还是适用于幻想系爱情故事。这几位主演都算是内地较有特色的青年男演员了，希望他们多在文艺片里磨磨刀。,3,2020-10-04 13:04:54,14,0,0,0,0,0,0
216,一点就到家,尘,设计感太强的电影 中间一段节奏还不错 可呐喊到最后成了心灵鸡汤 云南扶贫成为了背景而不是环境 情节也不会激起人想理解人物的欲望 所以最终只能沦为平庸 远不如《中国合伙人》6.5/10,3,2021-02-20 20:48:18,8,0,0,0,0,0,0
217,一点就到家,kakakarl,3.5，缺乏真实支撑的创业故事，怎么看都会显得鸡汤。借由角色之口，还说出来了很多成功学性质的话语，最有意思的是调侃《中国合伙人》和哈利波特。但是很喜欢三个演员，互相都有CP性，我是他们三的群体CP粉，简称群P粉，三人拉手睡，甚至还有彭彭吃醋的画面～尹昉在夜色里的侧颜，也太帅了吧！,3,2020-10-04 21:14:56,3,0,0,0,0,0,0
218,一点就到家,某J。624,卡司+许宏宇，交出这样的成品实在有点说不过去。最大问题在本子，像是个匠气十足的模范例文，还是十年前的那种，以至于摄影和剪辑那点俏皮趣味都被时不时的煽情mv冲散得七零八落。倒也不是说煽情不好，可惜全都没在点子上，难得有些动容的地方也好似怕观众被虐哗啦一下子就翻了篇。P.S.不想着怎么讨好观众，而是稳稳当当地讲一个「回」的故事多好。,3,2020-10-12 02:14:41,3,0,0,0,0,0,0
219,一点就到家,私享史,跟处女作《喜欢你》的优点一样，许导演的节奏感真的很好，剪辑风格也轻快；缺点也一样，就是剧本撑不起来，前半程故事讲得很舒服，后半程突然来个戏剧冲突（本片是收购谈崩友谊破裂，处女作是厨师换人爱情破裂）把故事冲垮了。另外，对于两片同样把现实理想化的设定，在《喜欢你》里“亿万富翁与普通女孩相爱”是可以接受的，在本片里“创业之路一帆风顺一笔带过”却是难以接受的。总之，两片剧本都先天不足，能靠导演和表演把戏撑到及格，实属不易。,3,2020-11-21 02:05:10,5,0,0,0,0,0,0
220,一点就到家,Picasso影业,及格的轻喜剧电影，搞笑的部分不算出彩，正能量的部分不算尴尬，平平淡淡地结束了。无功无过，考虑到是导演处女作，很值得鼓励。拜托刘昊然不要再演这种智力优越的天才小少年，看得累了。,3,2020-11-18 03:52:20,1,0,0,0,0,0,0
221,一点就到家,桃酥酥,前半段很棒，搞笑温馨又淳朴，后面直接变成央视财经频道是闹哪样？,3,2020-11-18 00:26:23,2,0,0,0,0,0,0
222,一点就到家,君心sola,非常一般 创业题材也能拍的这么平庸无趣缩减到三十分钟并入电影我和我的家乡 说不定更好呢,3,2020-10-05 00:20:48,11,0,0,0,0,0,0
223,一点就到家,文白,2.5。想起UFO时期那些轻松的中产小品，不同的是，这部先天主旋律的局限，所以最后真的是靠导演的技巧才能出来这样的效果，在商业小品领域，许宏宇未来可期。,3,2020-10-04 12:38:23,9,0,0,0,0,0,0
224,一点就到家,Lies and lies,半部《中国合伙人》。虽然结尾左右互搏，但跳切式的快摇和幽默的调度仍有主旋律解毒之效。,3,2020-10-27 00:18:16,1,0,0,0,0,0,0
225,一点就到家,和寂寞一起悬空,有没有远山树林的味道？有,3,2021-03-27 19:50:37,2,0,0,0,0,0,0
226,一点就到家,凸肚,三位正当年华的男演员，演绎年轻人回乡创业的故事，很符合当下的就业环境，也给迷茫中的毕业生以勇气和启示。三位实力派流量的合作，为小而美的喜剧作品，贡献了突破性的演出和亮点。,3,2020-09-29 10:51:42,0,0,0,0,0,0,0
227,一点就到家,罪惡剋星烏蝇哥,前半部还不错 后半部有点尬,3,2020-11-17 23:59:11,1,0,0,0,0,0,1
228,一点就到家,小汉堡,一大碗鸡汤,3,2020-11-09 00:21:57,2,1,0,1,0,1,1
229,一点就到家,开膛手贝塔,一般的电影情绪是上下上下上下下下下上上！现在一些电影的情绪是上下上下上上上上上上上下上上上上上上！！！！！！！！也不是不好，但全是这种，只有这种，还要这种，就一定不好。,3,2020-11-13 00:01:59,5,0,0,0,0,0,0
230,一点就到家,JoeyLu陆柏宇,笑点高能招笑，看得很来劲,3,2020-10-10 14:51:19,0,0,0,0,0,0,0
231,一点就到家,宁静致远,非常一般。其实题材是有优势的，但拍出来就都意料之中的东西，没有什么惊喜和亮点。最近天天看到开帖子吹这部国庆档黑马， 多好看多好看的，可悠着点吧。如果真信了的人去看会瞬间落差太大。还有某主演的演技真不咋样,3,2020-10-04 12:32:10,5,0,0,0,0,0,0
232,一点就到家,好好地,比预想强一点，但笑点尬鸡汤齁，强行国民荣誉感国民自尊心，都要立一个“星雀”的假想敌来实现。以及三个人吵架的高潮戏，麻烦台词跟台词之间逻辑理顺一点行不行？跟情侣之间无理取闹似的，我看着都干着急，想说能过过不能过赶紧离！最后，强行卖腐不能忍。两星半。【以及，真的，流量演员的路人好感早晚让粉丝给败光。,3,2020-09-28 17:23:23,5,0,0,0,0,0,0
233,一点就到家,李少白,很一般,3,2020-11-18 00:01:16,1,0,0,0,0,0,0
234,一点就到家,今天不想上班,鬼灵精怪是真的 创业这么easy是假的,3,2020-11-18 02:13:35,1,0,0,0,0,0,0
235,一点就到家,陈益达,阿里的宣传片吧。中国合伙人第二季？平平无奇，冲突来的莫名其妙,3,2020-11-18 00:54:43,2,0,0,0,0,0,0
236,一点就到家,龙皇,创业励志片，年青现代版乡村合伙人，但感觉更像是咖啡宣传片。种卖咖啡创业成功也太容易了吧，我一度以为他们的咖啡会卖不出去。,3,2020-12-27 18:08:55,1,0,0,0,0,0,0
237,一点就到家,朱雀不见家门,设定太像王宝强跟徐铮了，我看的时候全程在想要是王宝强很徐峥来演会好看很多，刘昊然太年轻太帅了，演这种角色毫无说服力，很出戏，彭昱畅还可以。,3,2020-11-18 00:58:46,2,0,0,0,0,0,0
238,一点就到家,Mia,青春片外衣包裹下的农村创业脱贫题材，在国庆档还是挺讨巧的~,3,2020-11-13 15:27:22,1,0,0,0,0,0,0
239,一点就到家,无与伦比,没有特别触动我，剧情比较清淡，有几个笑点还不错。,3,2020-10-05 07:33:07,8,0,0,0,0,0,0
240,一点就到家,MFT,全片鸡汤过多，太腻了。矛盾冲突永远离不开钱，而最后也超越了钱，普通励志片的基本套路。那个咄咄逼人的女人凭这种本事还能坐到那个位置，公司高层都是群傻子吗？艰苦创业精明人，世界公司铁憨憨。,3,2020-10-04 12:12:54,17,0,0,0,0,0,1
241,一点就到家,阿暖,本质和《中国合伙人》一样，是过于讨好的成功学电影，但格局更小，论点更浅。养生朋克，文艺卖钱，小镇青年的阶级跨越，每一个角色、每一个细节都是精准点草。,3,2020-10-04 11:21:03,13,0,0,0,0,0,0
242,一点就到家,こがね,刘昊然和尹昉选得不好 只有彭昱畅感觉对了 拼贴感严重 导致两首湾湾歌曲主题虽然适合 但就是融不进去 情节一步一步在预料之中 冲突来得是不是有点晚？后期总感觉要结束了 但是又来一个片段 整体不太满意吧 （刘昊然嘴皮子还要努力,3,2020-10-04 10:58:28,32,0,0,0,0,0,0
243,一点就到家,苏城,一部一点也不好笑的喜剧片，唯一让我动容的是那句邓布利多老爷子的金句：我们经常在正确和容易的事情之间做选择…,3,2020-11-18 01:01:59,1,0,0,0,0,0,0
244,一点就到家,韦恩斯坦_李,整体喜剧故事的欢快度还是可以的，就是那种夸张的“春晚式”表演让人不舒服，不过比家乡那种夸张还好一点。虽然是谈创业，看起来很励志的样子，但其实给人的感觉就是很理想化，创业的艰难简单表现了一下，难以给人完全的信服感。这三个小鲜肉表演还行吧，刘昊然最讨喜，但是演一个历经风浪的创业者看着还是太嫩了。,3,2020-10-17 01:22:52,1,0,0,0,0,0,0
245,一点就到家,深蓝色幽默,当个热血动漫来看 大概就比较合适了~~,3,2020-11-24 16:12:43,1,0,0,0,0,0,0
246,一点就到家,SydneyCarton,跟《夺冠》一样，其实也提出了自己没法回答的问题，但它体量小，步子轻盈，纯当喜剧看也没有任何问题。影片的调子在跳跃的漫画味和粗糙的网大质感之间游走，还好，选角不错，三个男孩的元气足够旺。,3,2020-10-09 21:48:00,1,0,0,0,0,0,0
247,一点就到家,Kannimeia,勉强给个三颗星。搞笑的部分有点儿太尴尬了，再加上出戏的动画效果，观感实在是比较差，要不是从positive energy角度出发，我估计就给两颗星了。剧情是简化版的创业小故事，一切东西都太理想化，可以当作娱乐产品看看，但一定不要觉得是真的可能发生的故事。可以这么比喻，这个片子就像是创业界的童话故事，愿景很好，也是个打工人的鸡汤，至于有多少人能靠近这个目标就是另外的问题了。在这里也祝愿天下所有努力着的人终修正果。,3,2020-11-23 06:11:04,5,0,0,0,0,0,0
248,一点就到家,戚阿九,能听见远山树林的声音...配合手势特别...传教...,3,2020-10-04 22:52:51,10,0,0,0,0,0,0
249,一点就到家,连城易脆,越来越多的国产主流商业电影愿意关心三农问题自然还是乐于见到的，陈可辛+许宏宇的组合使得电影的表现手法显得确实非常成熟。关于新农村建设的问题，正好最近在看前世界银行副行长林毅夫的一本书《解读中国经济》，里面也有涉及到农村改革的相关问题，提到农业产品由于收入弹性小和价格弹性小，才导致增产不增收的现状，要真正解决这个问题，其实还是得继续搞城市化，把大量的农民从农村中解放出来，从事非农业的生产，也就是所谓的农村劳动力转移。而剩下来的农民则应该生产符合各地比较优势的农产品，并不断拥抱技术变迁。整个国家层面建立统一的市场，并努力减小交易成本，那么在逐步交易的过程中差距就会自然缩小，所谓的要素均衡理论。短评内容有限，挂一漏万，我个人觉得电影人可以多吸收这些理论来作为创作电影的灵感和依据。,3,2020-10-05 22:20:04,6,0,0,0,0,0,0
250,一点就到家,李不贱,要是没有盲目独白升华，和创业一帆风顺的剧情，会让人不那么出戏,3,2020-10-12 12:04:57,4,0,0,0,0,0,0
251,一点就到家,麻薯芋泥蛋黄酥,可能是期望太高，看完真的觉得一般。梦境的部分太出戏了，后面节奏快得有点乱，以及昊然弟弟一演聪明人就变成秦风了。,3,2020-11-18 00:48:09,2,0,0,0,0,0,0
252,一点就到家,玄辂Hyunlu,仿佛听见看完试映的人告诉主创：好消息，这电影找个合适档期能赚钱；坏消息，这电影质量不行不会给主演事业上的帮助,3,2020-11-21 14:26:42,2,0,0,0,0,0,1
253,一点就到家,обломов,青春版合伙人，瑰夏躺枪,3,2020-11-12 21:06:32,0,1,1,1,1,1,1
254,一点就到家,ajs0609,轻喜剧+非常讨巧的商业电影，娱乐一下～3星吧,3,2020-11-18 02:35:35,1,0,0,0,0,0,0
255,一点就到家,CobraCB,看到剧情简介就知道又是一碗鸡汤，却没有想到这碗鸡汤实在过于清澈了看不到一丝油星，纵观全片，从送快递到卖咖啡，完全感受不到创业受到了什么太大的阻力，少有的一些挣扎，也不过是三个人最初的信念有一些偏差而已。对于陈可辛系相关电影来说，这部确实是非常贴近当下所着力宣传的创业和回家主题的，他一向知道应该抓住什么，而对于导演过《喜欢你》的许宏宇来说，可以说是些许倒退，毕竟拍自己没有类似经历的事，光靠天赋和臆想是不行的。,3,2020-10-05 02:11:53,9,0,0,0,0,0,0
256,一点就到家,李大米,对于一个也在创业深坑刚治好失眠，依旧迷茫逃避的人说真是一个可爱的童话，可能我老了，我现在就是开场瘫在车里的刘昊然，跟我说什么打鸡血的话我都能KY回去，笑完又觉得苦涩（这是我个人问题）。但片子本身还是推荐看，因为我也想去乡下住，光云南的风光就够治愈了，莫名感觉有点哪儿哪儿神去村的画风，目测是国庆档里最好笑轻松的片子了，今年有点苦涩，没心没肺的笑笑挺好，尤其是彭彭出来我都想笑怎么回事，有黑马相，期待多点这样的国产青春片，不要只知道谈恋爱。,3,2020-09-28 19:56:23,20,0,0,0,0,0,0
257,一点就到家,张苑希,上山下乡扶贫政策推广糖水片，算是各方面调控得还不错的轻喜剧，主题讨好立意讨巧演员讨喜。缺陷是剧作所设计的矛盾冲突太流于表面，主角们的创业之路顺利得难以置信，空喊口号而无内蕴使得整部电影沉浸在如童话般甜腻的理想主义氛围里。当然也并不算得上难看，说是低配版《中国合伙人》倒也贴切，只是（陈）监制与导演之间的职务调配，格差终归是大了去。,3,2021-02-07 17:35:56,0,0,0,0,0,0,0
258,一点就到家,ninej950,大型阿里巴巴软广！男主们很优秀！,3,2020-10-04 23:21:34,6,1,1,1,1,1,0
259,一点就到家,老罗Lazzaro,乡村合伙人创业记，有趣成功的轻喜剧小品，切入点好，明亮的镜头与剪辑风格占一半功劳。到后段还是显出不少设计的鸡汤励志，放到《我和我的家乡》的一个片段里能评到最佳。,3,2020-10-07 14:48:17,0,0,0,0,0,0,0
260,一点就到家,鶩習,脱贫金手指小爽文，三星半。剪辑优秀程度＞拍摄有趣程度，联合拯救了剧本。人物关系直到一小时后才算建立起来，前面散漫拖沓流水账，不好好讲故事全靠蒙太奇炫技，努力咯吱人笑但稍嫌尴尬，疑心拍的不行靠剪辑挽救。终于在一小时后，利用外力作用激发矛盾开始煽情到高潮，由于演员青春可喜真诚不油腻，倒也不讨人厌。,3,2020-10-02 22:11:07,14,0,0,0,0,0,0
261,一点就到家,黄悦_,意外地还不错 就算前半部分太过于戏剧化（对摔来摔去这样的插科打诨很不喜欢）我也还是觉得可以给7分 关于年轻人创业梦想、关于乡村扶贫、关于和家里人的爱等等。大家都说没钱就没有快乐 但是人生的重点在于选择啊 我选择带领大家种咖啡可以造福大家 我选择放弃300百万来保留自己的梦想 仔细想想 赚钱真的没有那么重要吧。在天台跳下去吧 所有烦恼都没有了 在山顶跳下去吧 人就会飞起来 这都是选择问题。PS八三夭的片尾曲《我不想改变世界 我只想不被改变》太好听！PPS谭卓真好看！,3,2020-11-20 10:10:40,0,0,0,0,0,0,0
262,一点就到家,Clyde,果然是《中国合伙人》的低配版+乡村版。主旋律的“健康化”、“美好化”，不必苛责，台湾当年的“健康写实主义”也是如此。,3,2020-12-21 17:29:03,0,0,0,0,0,1,0
263,一点就到家,隔夜油炸鬼,命题作文的答案是及格的。但过于讨巧低只聚焦于三人的故事，需要逻辑推敲的各方利益及可行性的剧情草草带过。镜头剪辑有点意思，但不够干脆，拖动的镜头还不如直接跳剪一下更有节奏感。,3,2020-10-10 16:50:18,1,0,0,0,0,0,0
264,一点就到家,生人回避,如今的彭彭，颇有黄渤般一路开挂的气势，就连戏路都有黄渤的影子，但愿他的未来不会因此走入瓶颈。,3,2020-12-13 00:11:29,0,0,0,0,0,0,0
265,一点就到家,T.V.Zoe ி,各方面都做得很好，最出彩的应该是剪辑节奏一直控制住观众了。不过整个片子都是刻板印象，就挺没劲的了。,3,2020-11-14 16:39:55,0,0,0,0,0,0,0
266,一点就到家,巽,彭彭可爱。拍得中规中矩，主要还是彭彭可爱。乡民的表演和方言略有加分。,3,2020-12-08 00:59:38,0,0,0,0,0,0,0
267,一点就到家,被迫改名的我,有巧思不周正。拿咖啡和年轻人对比茶和老一辈很有巧妙，可是对比论证的方法不是很好看，最终呈现在大银幕上的观感就是一个网大质感的广告片。所以我们真正爱家乡的内核，和我们对于民族品牌的理解，对于商业化尤其是跨国公司的意识，我们对于农村年轻人出走，年轻人创业等等社会问题都是点到为止的，段子也是点到为止的搞笑，总之国产类型片真的适合在腾讯视频看。,3,2020-10-04 12:23:42,3,0,0,0,0,0,0
268,一点就到家,顗礼,一部非常奇怪（褒义）的、几乎每时每刻都濒临崩坏边缘却没有崩坏的片子，很难想象陈可辛和许宏宇到底是以什么样的心态执行的这个项目，剧作模式算《中国合伙人》精神续集，剪辑意识延续《喜欢你》的轻快灵动，高饱和度调色，多种类型元素嫁接，有相当多过火无厘头的脑洞时刻，动画质感与反派设置打脸“药神”式“伪现实主义”（甚至直接找谭卓来演了一个失真符号化的反派），然后这还是个主旋律电影，点不要再多哦,3,2020-09-26 16:44:28,10,0,0,0,0,0,0
269,一点就到家,所有团的团长,整体很套路，但是还算有趣。创业要是真的像电影里说的那么轻松那大家都能去创业挣钱了。7分。,3,2020-10-04 21:22:42,3,0,0,0,0,0,0
270,一点就到家,清舞翩翩,平平淡淡的农村推广电商片，农村遇到网购大部分问题讲的都不错。很多场景特效都假的过了完全没必要，刘昊然的演技不会巅峰是最好的我们吧！彭昱畅黝黑土里土气真是快递员全片演技担当，尹昉卖咖啡种咖啡想要被认可本质还是商人。谭卓可有可无的角色客串过来碾压一下三个气场也没必要，村长全片搞笑智慧把农村的规矩坚守表达出来了。现在农村大部分老人都是拼夕夕还不错，云南千年古寨宣传片想去！！,3,2020-11-13 17:48:21,1,0,0,0,0,0,0
271,一点就到家,零点七,感觉像看过一百次的自我代际城乡和解剧本和不入流也非常傻逼的飞猪特效搭上了2020年的政治快车和无聊热点摇身一变成为了我国城市最爱的高饱和度招商平板,3,2020-10-08 21:43:49,1,0,0,0,0,0,0
272,一点就到家,momo,看了一个半小时淘宝宣传片…,3,2020-10-04 14:18:23,8,1,1,1,1,1,1
273,一点就到家,censored dump,中庚春天影城。2.5/5. 按说选题很有深度，村长那句“他们失败不起”其实挑明了改变的代价，但拍的实在是，快速剪辑+漫画式特效+特色配乐，风卷残云的视听捋平了剧作障碍，可明明是小妞电影的套路，女性角色却那么刻板。更深的问题是，主题在强调坚持自我不要被标准化，所有的转折却在向标准化的平台献媚，李佳琦和二维码成为一种符号，将改变美化为成功。讽刺的是，这正是主题的一部分，经济活动改变的永远不只是经济形态，还有文化和观念，就像集市，就像宗教化的快递，就像三人看日出的“美景”，让我前面的观众激动地举起手机屏摄。,3,2020-10-08 21:48:03,3,0,0,0,0,0,0
274,一点就到家,团小纸,许宏宇和三个娃都是难得年轻人，值得让他们再多试几次，一定会磨出很好的东西的。,3,2020-11-25 22:13:10,0,0,0,0,0,0,0
275,一点就到家,Reze518,谜之特效，前半段太尬,3,2020-10-04 12:09:48,5,0,0,0,0,0,0
276,一点就到家,Brig,很难不让人觉得是双十一前的大型广告。,3,2020-10-05 11:57:31,7,1,1,1,1,1,1
277,一点就到家,Eco,幸福来的太简单，成功全凭热血，电影预先假定任何事物都能被个人奋斗所改变，所以一切的困难看起来都非常短暂且刻意。三个好演员，但电影偏偏要依靠剪辑勾引你。振兴农村热血青年，即便如此，仍然是国庆档最好的电影。,3,2020-10-07 11:52:21,1,0,0,0,0,0,0
278,一点就到家,Dear Cosmos,演员最出彩。风格上想走埃德加·赖特的快节奏视觉戏剧，但是不少地方做得很杂乱，煽情的部分很卖力有些毁观感。笑点抓得还行，很年轻，这个氛围甚至让人能够原谅一部分廉价到发指的特效。主旋律拍得有活力很难得，但也仅限于共青团的水平。,3,2020-10-04 18:10:19,5,0,0,0,0,0,0
279,一点就到家,scofieldd,钻研三年就研究出世界第二的咖啡也是太扯了点，这命名式的乡村扶贫主题感觉像是隔壁我和我的家乡单拎出来的一个短片，三个年轻演员的表演很灵性，导演有好几场戏都挺有想法的，未来值得期待,3,2020-10-08 16:53:15,2,0,0,0,0,0,0
