,movie_name,id,short_comment,score,comment_time,votes,Fake,Marker1,Marker2,Marker3,Marker4,Marker5
131,一点就到家,又又,很好看啊！超过预期！非常接地气，而且远离城市的农村场景看着就很小清新，想到了《哪啊哪啊神去村》，一点都不俗气，真的挺好的。前半段很搞笑（真的让人笑得出来的那种搞笑），后半段涉及到了一些还蛮复杂的议题，虽然没有怎么深入讨论但还是拿捏得挺好的。一点小不足就是结尾成功得太假像做梦一样假。另外村子里老人怀念以前的集市还挺让人反思，电商确实会带来遗憾，不过电影却是一笔带过，其实可以有更好的处理方法。彭昱畅演技吊打另外两人啊，他真的演什么像什么！,4,2020-10-05 20:44:33,7,0,0,0,0,0,0
132,一点就到家,煜翊,影片中Cue到了好几个现实热点：老龄化的村庄和逐渐返乡振兴的年轻人，阶级分化和年轻人创业，原生家庭关系等。从把货带进来到把货带出去，虽转折有点突然但最终上了价值。和我和我的家乡同时放映叙说农村问题，还是蛮不错的。3位主角都非常喜欢，特别是彭彭演的入木三分鲜活动人。整部影片喜剧性还是蛮强的，有好几个场景很搞笑。,4,2020-11-22 12:00:16,1,0,0,0,0,0,0
133,一点就到家,幻影菌,人物很生活化，兄弟间的打闹互怼很真实。喜剧效果不错。相对《我和我的家乡》，这片子算击中了农民离乡和留守老人的痛点。前半部分不错，后面三人联合创业过于顺利。只有谭卓收购时激发了内部矛盾；一并而来的本土品牌与进口大牌生存空间的讨论也随着一口远山树林风味的咖啡抛在脑后了。ps：几个插曲很加分。,4,2020-10-24 14:32:36,2,0,0,0,0,0,0
134,一点就到家,冰仔,不油腻不尬，就已经算是华语喜剧界一股清流了,4,2020-10-07 08:11:53,4,0,0,0,0,0,0
135,一点就到家,时柒,刘昊然皮肤好好，他好可爱，这就是我的关注点哈哈哈哈哈哈，电影中规中矩，坐在影院看笑点是够的。我认为拍这个题材的意义很好，三⭐加一⭐鼓励～,4,2021-03-18 12:53:32,0,1,0,1,1,1,1
136,一点就到家,Hushnore,被安利了云南咖啡,4,2021-02-19 03:08:56,1,1,1,1,1,1,1
137,一点就到家,一片五花肉,阿里巴巴年度最佳广告👍,4,2020-10-12 21:59:45,2,1,1,1,1,1,1
138,一点就到家,齊克斯尼力佐飛,不算特别好，不过喜剧感不突兀，不靠卖蠢丑搞笑就好感。艾怡良的 Forever Young响起时感到欣慰。,4,2020-12-09 12:39:09,0,0,0,0,0,0,0
139,一点就到家,狐狸,1.摇镜头的摄影和快速特写剪辑略显轻浮了，但能理解是因为做这样的喜剧片；2.请彭昱畅再合适不过了，他一扮上就是云南农村的小年轻；3.看来云南农村不只能拍曹保平的犯罪片，还能整点喜剧，虽然是有点尬的喜剧；4.这部片子的积极意义已经大过片子本身了，所以还是希望这样的电影存在,4,2020-11-12 03:51:37,1,0,1,0,0,0,0
140,一点就到家,哈尼南南,跟着哈哈哈也跟着感动，但也清楚的知道是成功学小故事。送快递、种咖啡、种茶叶、帮寨子人买下单买电器、到明年也是离开家来北方的第十年了、除了没主角积蓄、人脉和决心，其他所有地点和经历都是亲身经历的，有那么一瞬间会觉得，他怎么在拍的我的生活经历啊，十一没能回家，但在大荧幕回了一趟老家了。,4,2020-10-09 22:22:30,4,0,0,0,0,0,0
141,一点就到家,Dreamer,咖啡合伙人，创业不易，才华与机遇都必不可少。面对被收购，拿钱走人，还是拒绝金钱的诱惑，坚持自我，也是创业人小有成就以后的必经之路。全片剧情流畅紧凑，笑点泪点兼具。父子多年后的和解令人动容。昊然弟弟戴眼镜真好看。,4,2020-10-02 22:50:58,0,0,0,0,0,0,0
142,一点就到家,绣绣,出乎意料的好看，云南很美，故事也不错。情节紧凑，关于梦想和追求。符合当下年轻人的价值观，值得一看。,4,2021-02-16 23:49:40,7,0,1,0,0,0,0
143,一点就到家,雪中来客,真正说中国人的故事，多一点，鼓励。“站直了，别跪下”,4,2020-11-11 02:38:13,2,0,0,0,0,0,0
144,一点就到家,默语生,国庆档小黑马，解压的同时还兼顾了情感诉求和现实关照，能把下沉三线、乡村空心化和精准扶贫写成这样，蛮不错的答卷。导演上一部《喜欢你》就让人觉得眼前一亮，算是国产小成本类型片的清流，这部片子质感也不错，剪辑轻巧干净。几个小鲜肉表现合格，不雷人不出戏，乡村轻喜剧版《中国合伙人》，台词还特地cue了一下三个教英语的，笑死。不过在某类人比如我眼里，这根本就是一个种田流的耽美小甜饼啊我的天哪，一个工于算计创业失败精英白领受，一个天真纯朴回乡致富快递员攻，中间还隔着一个叛逆文艺种咖啡的农民基友，结尾部分三个男主字面意义上奔向彩虹，堪称是近期呈现这一元素既大胆又含蓄的巅峰，简直了。耽美文学爱好者们推荐一观。四星。,4,2020-10-04 19:05:09,5,0,0,0,0,1,0
145,一点就到家,Ricky,比想象中要好很多，节奏够快，笑点也足，一些尴尬的地方和五毛特效要说是符合这乡土气息也不是不行。尹昉好像又变帅了,4,2020-10-10 16:17:09,0,0,0,0,0,0,0
146,一点就到家,懵懂,一边调侃，一边假装正经的讲了主旋律，很难得,5,2020-12-02 20:36:21,5,0,0,0,0,0,0
147,一点就到家,momo,虽然特效不怎么样，但刘昊然和彭昱畅还是不错的。尹昉好黑啊！,5,2020-10-10 19:16:24,0,0,0,0,1,0,0
148,一点就到家,极圈里的燕鱼,宣传片和海报无疑拉低了影片内涵，劝退了潜在受众。远比预想中精彩，谈不上惊喜，但还是颇有感悟。一个出色的剧本，让人物鲜活让情感立体，台词的深刻和现实超乎想象，以为是年青一代对传统的碰撞与挑战，其实是直面迎击自己的迷茫和软弱，有理想也有挣扎，没有盲目热血，没有落入俗套，正中当下年轻人的下怀，痛处痒处有切入也有释放，这与内心的一战赢得质朴也赢得体面。而且承认它拍得很美并不难，的确粗糙的特效和蹩脚的配音令人出戏，但这个构图景别影调和布光，这不是黄路村的后山，这是狮子王啊。,4,2020-10-18 22:14:43,2,0,0,0,0,0,0
149,一点就到家,琧婯,喜剧手法相对轻松地表达了很多社会话题和变化，只要能让更多的人开阔眼界，我觉得就挺好的,4,2021-06-13 17:20:54,0,0,0,0,0,0,0
150,一点就到家,sweetbear,虽然看着像宇宙的阿里帝国宣传片或《我和我的家乡》加长版，但这个故事非常完整，导演节奏把控一流，最近一直在琢磨主旋律电影算不算电影，还在思索中。最后，彭彭的光芒，在大银幕上完全无法阻挡。,4,2020-10-06 21:59:12,3,0,0,0,0,1,0
151,一点就到家,马史,导演水准相当可,4,2022-05-18 02:53:53,0,0,0,0,0,0,0
152,一点就到家,胀鼓鼓要长高高,许导真的牛逼，刘昊然的角色跨度很大，二十几岁就演出了三十几岁中年男人的失意和落魄，演的非常好,5,2020-10-04 10:56:20,19,0,0,0,0,0,0
153,一点就到家,fish,u1s1，整体还行啊，彭彭一开始进入角色就和本人完全不一样了，另外两个还能看出来就是他们自己多一点儿。总的来说新生代演员们潜力都不错呢，今天看了四部电影，妹妹最好，然后是彭彭，然后四字弟弟，再再然后就是剩下几位了了。云南小粒咖啡是真的好喝，真的买不到。。。最戳人的一句话是非洲咖啡种植园已经上百年了，他们还一样。资本家当然不会帮他们建设家园，撑死意思意思慈善一下，根本不解决问题，人家也不想解决问题。而我，真的是在帮助建设，脱贫我们是认真的。有一丢丢小感动。,4,2021-05-24 03:00:20,0,0,0,0,0,0,0
154,一点就到家,红豆♥,我……感动得一塌糊涂,4,2020-11-16 17:45:37,3,1,1,0,1,1,1
155,一点就到家,宅拾叁,结尾的赶集我以为要怀旧。虽然自黑了中国合伙人，但内核还是心灵毒鸡汤。但胜在轻喜剧快节奏和眼花缭乱的台词接龙，国庆档第二这个样子吧。,4,2020-10-19 20:11:08,0,0,0,0,0,0,0
156,一点就到家,冰镇西瓜橘子水,国庆档看的最舒服的电影 导演太会选人了 三个人化学反应多到爆炸 很久没看到这么充满朝气的电影了 虽然结尾有点理想化 但是谁说有一天不能实现呢？？,5,2020-10-04 20:30:49,14,0,0,0,0,0,0
157,一点就到家,李濛Lemon,三个主演蛮讨喜的，表演恰到好处地浮夸却不尴尬。电影虽有浓浓的励志鸡汤味，但是不令人反感，与其说是创业励志片，更像是给都市人解压的浪漫轻喜剧。云南风光算是一大看点，满眼的蓝天绿树，养眼极了。,4,2020-10-05 10:11:04,12,0,0,0,0,0,0
158,一点就到家,国王KING,4.5。超出了期待，有几场戏情感冲击力蛮强的。创业过程也太幸运了……所以还是电影故事啊。,4,2020-11-18 19:01:20,0,0,0,0,0,0,0
159,一点就到家,黑色大丽花,本片所有的好👌🏻 ，都是因为导演的老师陈可辛创业类影片教得好。,4,2020-11-09 22:47:57,0,0,0,0,0,0,0
160,一点就到家,满江红,挺好的啊，人物塑造都挺丰满，台词也不尬，虽然有些理想化，但毕竟是一部轻松的喜剧，整体剧本和导演把控都完成了任务，演员方面彭昱畅最出色，刘昊然也不算违和，尹昉相对一般，怎么这部电影中他长得那么像斋藤工啊,4,2020-11-11 19:57:39,1,0,0,0,0,0,0
161,一点就到家,张兮兮,作为一个“致富经”的命题作文，导演和三位主演的表现都令人惊喜，在短短的一个半小时内，完成了“年轻人创业、精准扶贫、支持民族品牌”的三大宣传任务，又不乏轻松自然的笑点，还有对传承和创新的思考。这种充满新时代蓬勃朝气的电影，正是我想要看到的电影，所以我打五星！,5,2020-12-01 12:42:27,0,0,0,0,0,0,0
162,一点就到家,不脱袜子同学,国庆档最佳，日式回乡题材结合了中国梦。最好笑的点是调侃了《中国合伙人》，还有那些回乡农民快递员的台词彩蛋——“我叫张冀，我在深圳坐过牢”，还有“我叫陈X，原来在成都卖电影票”，说自己是武昌鱼的斯文编剧过了把浪子回头的瘾，顺带还调侃了下电影行业，不如归去送快递……,4,2020-10-10 22:47:09,1,0,0,0,0,0,1
163,一点就到家,圆滚滚是我哟,真的太搞笑了吧～这么短的时间把梦想，扶贫，创业结合在一起，不容易。,5,2020-10-04 09:48:25,32,0,0,0,0,0,0
164,一点就到家,Muhy,好喜欢刘昊然彭昱畅这个电影拍得还挺好玩,5,2020-10-04 00:33:43,0,1,1,1,1,0,1
165,一点就到家,蜜炼川贝枇杷膏,国庆档里最好的一部作品来的晚了,4,2020-10-04 22:22:34,16,1,1,1,1,1,1
166,一点就到家,蓝霉沉皮,不要用现实考量喜剧片，人家明明在提及范围的所有主题都做了很好的落地。爽就是爽，节奏真挺好。彭彭的造型和演绎真的很不错很不错很不错。,5,2020-11-26 00:31:35,0,0,0,0,0,0,0
167,一点就到家,princessagatha,还算不错的一部任务电影，把扶贫主题消解成创业梦想，切入点取巧～～人物关系配置类似当年的中国合伙人，片中也有段台词致敬，虽然三个人演技不如合伙人的三个成熟，在这部片里也够用了，彭昱畅>刘昊然≈尹昉～～～整体轻松、愉快，是国庆档中比较独特的一部片,4,2020-10-02 16:53:06,38,0,0,0,0,1,0
168,一点就到家,故梦,好好看！好久没看过这么轻松愉快且剧情流畅的电影了！,5,2020-10-04 00:47:16,1,1,1,1,1,1,1
169,一点就到家,飘飘飞上天,这个国庆看到的所有主旋律里面最好看的，一把子买了早上的场来支持我家宝子，虽然没有他们唱的，但是听到我不想改变世界只想不被世界改变还是会笑一下，体会到小李在电影院的感觉了！祺祺妙妙！ 最后一下灵魂暗夜的时候刘昊然那个三方剪辑的平行蒙太奇对话好妙！每到这种时刻我都感叹电影的浪漫～,4,2020-10-04 11:44:06,19,0,0,0,0,0,0
170,一点就到家,晓晓一,愿科技、现代的理念让农村富裕、圆满、浪漫、诗意起来。题材很好，剧情略显简单。喜欢最后老奶奶追忆赶集的往事最后又掏出支付宝收钱码的小段落，时代就是这样，有些美好会消失，但未来也许也值得期盼。,4,2020-10-06 12:52:49,5,0,0,0,0,0,0
171,一点就到家,frontboy,不错的题材，有点搞笑，还是正能量满满，漂亮的美景，轻轻松松，惬意的很。,4,2020-11-21 15:39:18,0,0,1,0,0,0,0
172,一点就到家,闪电杰克,命题作文的惊喜之作！许宏宇太妙了，果然剪辑出身的人对戏的节奏把控力不一般，再无聊的段落到他手里就玩出了新意。剧本没有拉垮，演员选得也好，看后轻松又欣慰，即便是主旋律，也不令人生厌。,4,2020-10-26 22:32:58,2,0,0,0,0,0,0
173,一点就到家,Jo,超可爱热血梦幻的电影，全片笑点密集笑得前仰后合，后面慢慢深入引出了几个话题的探讨，完成度非常高。许导厉害，主角团之前的化学反应也很赞，特别是刘昊然同学，作为三人团的主心骨，非常稳非常优秀又非常可爱，心理医生独白、三人分手以及贡献的笑点有好几处都让我惊艳，不禁忘记他才是三个人当中年纪最小的。and光是hrdd怼脸大头都不输的颜值，就是值得再刷的作品了hhhh,5,2020-10-04 03:14:36,101,0,0,0,0,0,0
174,一点就到家,啊咧,有趣，这才是喜剧片应有的水准啊。虽然分歧的段落有点突然且强硬，但是演员演技都在线没有显得尴尬。总体非常接地气，且创意十足，立意够高，还小小的折射了一下社会问题，惊喜,4,2020-10-24 11:19:23,3,0,0,0,0,0,0
175,一点就到家,皮格马利翁,非常好非常好，我甚至看得出来剧本改动的痕迹，镜头的剪辑和情绪的积淀也够节奏，影视圈要多一些踏踏实实拍商业片的导演，而不是要么没有实践经历眼高手低，要么看不起这个看不起那个对标塔爷和贝拉塔尔的臭**,4,2020-11-12 12:46:24,1,0,0,0,0,0,0
176,一点就到家,picnic,三点五星吧，前半段比较好，展示了什么叫作命题作文，又快又好。,4,2020-10-06 18:08:32,4,0,0,0,0,0,0
177,一点就到家,Miss Lucky,评分怎么这么低，感觉还可以啊，彭昱畅演技不错,4,2020-11-12 18:33:13,0,1,1,0,1,1,1
178,一点就到家,大杰,看电影，回趟家。,4,2021-08-13 13:35:28,0,0,0,0,0,0,0
179,一点就到家,少年派的崛起,创业过程中理想与现实其实没有对错，就是选择，看你愿意被世界改变还是改变世界，电影很励志治愈，三位主角签合同散伙吵架那场戏最好看，前半部分的喜剧元素以及惊悚元素是亮点.当然现实生活中小村庄创业成功没那么容易，签合同还是最稳妥的选择,4,2020-11-15 00:12:37,0,0,0,0,0,0,0
180,一点就到家,渡口无边,3.5。内核依然在鸡汤故事的体系之内，“成功“来得过于顺畅。故事的转折发生在与资本的二元对立，但影片却始终提“站在风口猪都能飞起来”这样资本的话术，这些经不起推敲的矛盾对故事的信服力损伤挺大的。还好足够轻盈，节奏够好，也触及到了互联网之于农村这样少见的扶贫话题。,4,2020-11-28 21:13:48,1,0,0,0,0,0,1
181,一点就到家,一张疯子照,星雀，哈哈哈，怕不是星巴克+雀巢吧！,4,2020-10-11 08:38:19,3,1,1,1,1,1,1
182,一点就到家,柯小蚪,长篇扶贫旅游创业云南普洱咖啡宣传片。年轻人返回家乡创业，电商，物流，都是当下的社会热点话题。就像评论说的，命题作文不好写，容易套路化，但讲好一个故事，起承转合轻松愉快，即便是太过于理想化，也是合格以上了。,4,2020-10-11 14:35:07,2,0,0,1,0,0,0
183,一点就到家,小狐腻,其实我挺喜欢的，感觉很清爽，山村青春版《中国合伙人》。看评论里有人说有可能会是国庆档黑马，看了看排片，不太可能了。,4,2020-10-05 23:49:45,5,0,0,0,0,0,0
184,一点就到家,laurenⅢ,这是这几年看过的最真诚的电影之一了，有被打动到。,5,2020-11-14 11:51:05,0,1,1,1,1,1,1
185,一点就到家,风里刀,非常惊喜的。成熟的商业片。唉，但的确像其他人说的，内核非常虚无。快节奏的剪辑，甩镜头来剪辑的设计非常惊喜,4,2020-10-12 09:36:11,3,0,0,0,0,0,0
186,一点就到家,zephyrus,虽然终极目的还是为了梦想、为了成功、为了财富，灌了很多鸡汤也喊了不少口号，但喜欢里面年轻人该有的面貌，还没完全被世俗绑架的那种精气神。主题有一丝丝像《哪啊哪啊神去村》，乡野的治愈远超钢铁丛林所谓的“梦”。还有就是一些喜剧部分抖机灵抖到我心坎儿上了，开篇第一个“马”的包袱如果没在上班时间去互联网摸鱼摸过几年绝对写不出来。,4,2020-10-31 20:48:42,1,0,0,0,0,0,0
187,一点就到家,浅仁,预料之外的有意思。内容很丰富，三个年轻主角包括一帮村民们演技都可圈可点。挺欢乐的积极的励志的调调，挺好看的。,5,2020-10-09 18:25:53,1,0,0,0,0,0,0
188,一点就到家,Elika,我们总是在正确的事情和容易的事情中做选择，支持国产云南咖啡，不管是生豆还是国内烘焙，我一直都是这么做的。2020.11.15,5,2020-11-15 20:00:03,1,0,0,0,0,0,0
189,一点就到家,　,土气扶贫题材本身不够吸引人是一，节奏零碎是二，演员演技一般是三，图个搞笑看一看就算了。演技：彭昱畅>>>刘昊然、尹昉，刘昊然演技这么久都没进步我也是没想到,3,2020-10-04 10:09:37,1737,0,0,0,1,0,0
190,一点就到家,哪吒男,太成功 太纯洁 太正了 一个香港导演乐此不疲地带着团队在内地拍满分高考作文 我觉得金像金马金鸡都不足以评价陈可辛的成就 必须100000个高中校长联名送锦旗才行,3,2020-10-05 23:26:56,711,0,0,0,0,0,0
191,一点就到家,桃桃林林,是那种玩出来的电影，因为整个拍摄过程确实比较仓促，会有不少小遗憾，故事也会太顺了。好在一群年轻人的状态很好，大家玩的都非常尽兴，能在影片中感受到他们更自由的状态。属于比较轻松的一个片子。,3,2020-10-10 11:38:50,143,0,0,0,0,0,0
192,一点就到家,Martina,很规整，没惊喜也不算差，笑点和高光基本都被彭昱畅承包，漫画和特效的呈现方式我实在get不到。,3,2020-10-04 07:49:49,199,0,0,0,0,0,0
193,一点就到家,陀螺凡达可,前半段真棒，笑料大多都是镜头和剪辑带出来的，这才是喜剧电影的正常水平呀，单是那段恐怖段落就值得称赞。而且这片没有为了歌颂政策而设计一堆工具人，是真的在讲人和家乡。（我爱彭昱畅！,3,2020-10-06 18:18:43,52,0,0,0,0,0,0
194,一点就到家,朝阳区陆依萍,虽然最后一帮返乡快递员自报家门让我有一丢丢感动，但瞬间魂穿《八佰》的撞梗还是让我立刻清醒过来！#彭昱畅真的很适合演外表嘻嘻哈哈，但内心还要藏事的角色，是不错的#,3,2020-09-28 21:23:37,98,0,0,0,0,0,0
195,一点就到家,许琰稚,家乡和姜子牙满座，阴差阳错看了这部的点映，彭彭算是整部的亮点，继夺冠之后持续get到彭彭身上的黄渤气质。昊然弟弟油腻的感觉是怎么回事？希望是昊然弟弟演出来的！,3,2020-10-03 22:09:18,160,0,0,0,0,0,0
196,一点就到家,张猫大,“刘昊然，你到底囤了多少电影”看到预告时，在这片子条目下留下了这么句话。当时是欣喜的，谁不想能在银幕上多看到自己墙头的面孔，但在我和我的家乡就意识到没必要。拜托多接点扎实的片子吧，有点挑剧本的眼光吧，扔到老戏骨堆中磨炼去吧，别接男主戏了，多少年了演技想不想提升了。回归正题。很普通的故事，但作为喜剧，笑点却大多拙劣，还有本该用来映射现实的梦境部分，然因5毛特效褪去了升华效果不说，反而显得片子很没有诚意。胜在立意吧，鼓励年轻人回村创业，脱困扶贫，顺带宣传了一波中国云南的咖啡，若是能让观众对咖啡产地和咖啡质量有所改观，不再执着于进口，也算功德一件。,3,2020-10-04 15:37:03,110,0,0,0,0,0,0
197,一点就到家,寒枝雀静,Ｄ / 剪辑思路依然超群，包括局部的灵巧碎片编织，也包括有些重要情节点的时序转换。但是，按照高配版《我和我的家乡》（除了宁浩）的模式确实注定拍不好这个题材。《喜欢你》还是在相对裁剪了较多社会语境的前提下专注于二人情感的刻画，由此不疾不徐地引出阶级与品味区隔的暧昧关系。但《一点》则不得不过快过急地涉足更多复杂得多的经济发展甚至地缘政治论题，一个个抛出却又只能全数塞回那个欣欣然的框架中。或者换个角度看，在明快清新的气氛之下，它展现出了比《夺冠》高超得多的意识形态和稀泥技能（狗头）。然而到头来，依然只有那句“在北京你留不下一个脚印”显得格外真实。,3,2020-10-05 10:30:59,30,0,0,0,0,0,0
198,一点就到家,子戈,陈可辛监制，彭昱畅主演，所以应该叫《中国合伙人之向往的生活》。本质上是一部成人童话，一部鸡血式的励志片。优点在于节奏好，轻快，招人喜欢。但对照现实看，太假了。有人说，假不怕，电影不就是造梦的吗？电影造梦不假，但它造梦的方式又是很现实的。说白了，是用可能的方式完成了不可能的梦。听起来有点不可能哈，但你细看那些好的造梦电影，都是这样的。回到这部电影来，最大问题就是全片没有危机。这个梦从头到尾没有遭遇真正破灭的危险。是选择600万卖掉，还是选择继续自己干，这也算危机吗？这是在两个都不错的选择里，撒娇式地挣扎。而刘昊然回到北京，自己幡然醒悟又回云南的过程，也十分草率。总之就是成功太容易，困难太少，逃避了很多现实问题。这样当然看着爽，但爽只是爽，不是好。,3,2020-10-06 22:05:25,19,0,0,0,0,0,0
199,一点就到家,欢乐分裂,3.5；演员非常讨喜（彭昱畅真是太可爱了），拉高不少好感度；节奏明快，笑点与感人点掐得较准，很会结合时事抓热点，用Coffee or Tea指代两代人的观念差异、运营方式/创业眼界的改变。过于明丽高亮的色彩倒也契合类似某种滤镜，将乡村合伙人之路涂抹修饰得如新农村建设宣传片，类型片模式下又一次成功学口号的胜利——可能这才是正确/合适的过节观影打开方式？,3,2020-10-04 19:25:37,27,0,0,0,0,0,0
200,一点就到家,Peter Cat,剧作太头重脚轻，所有笔墨都用在构建这三个“可爱”人物以及他们社会困局，但成功太轻而易举，在主旋律商业片中，困局不需要解决，只需要眼花缭乱一顿轻快剪辑+配乐。这足够讨喜也相当狡猾。,3,2020-10-06 21:13:23,36,0,0,0,0,0,0
201,一点就到家,一壶好酒配热粥,乡村版《中国合伙人》，立足于农村扶贫开创出了一条与时俱进的电商致富之路，其灵魂是时下个体与家乡牵绊的人文内核，然而电影却没有很精准的捕捉到云南乡村该有的地气，呈现出的更像是一个虚构的乌托邦世界，优点是借此营造了不少荒诞笑料，但同时也失去了其背后深谙的人文意义，当“家”成为空洞的臆想，自然承载不了现实意味里所谓家的厚重。三个自带光环的主角的创业过程更被理想化的剔除创业途中的艰辛，所有成功更像是接连不断的巧合，以此又煽情的带出三人间的情感羁绊，即便是驾驭了成熟的叙事节奏，也难免让一句句励志台词变成了毒鸡汤。,3,2021-02-07 10:52:38,15,0,0,0,0,0,0
202,一点就到家,TiNZiNjiiM.,建議豆瓣出個3.5🌟的功能.,3,2020-10-04 18:21:08,18,1,1,1,1,0,1
203,一点就到家,周沐君,其实日本电影里有一大票就是表现这种“返乡青年”主题的，人家拍得也挺轻松幽默的，但问题并没有回避啊。咱这儿倒好，说得好像“返乡”的唯一障碍就是内心不坚定。只要坚持理想，大资本也一下就给你跪了……就算想宣传扶贫和新农村建设，也不用是这个路数吧……,3,2020-10-31 21:59:32,7,0,0,0,0,0,1
